{
  "command_id": "cmd_render_luminous_burnout_001",
  "source": "voice_input",
  "requested_action": "run_local_render",
  "natural_language_command": "يا رايز، حوّل نص الانطفاء اللامع إلى فيديو 30 ثانية بقالب قاموس مشاعر، بصوت Gemini، ورندر محلي فقط.",
  "project_context": {
    "workspace": "RAIZ_VIDEO",
    "project": "قاموس مشاعر العصر الجديد",
    "job_id": "luminous-burnout-001",
    "language": "ar",
    "direction": "rtl"
  },
  "payload": {
    "project": "قاموس مشاعر العصر الجديد",
    "concept": "الانطفاء اللامع",
    "template_id": "raiz-dictionary-card-01",
    "voice_provider": "gemini_tts",
    "output": "local_mp4",
    "publish": false,
    "duration_seconds": 30
  },
  "safety": {
    "requires_confirmation": true,
    "allow_arbitrary_shell": false,
    "allowed_paths": [
      "storage/jobs/luminous-burnout-001/",
      "storage/renders/"
    ],
    "secrets_in_payload": false,
    "audit_log_required": true,
    "network_allowed": false
  },
  "created_at": "2026-06-19T00:00:00.000Z"
}
